{
  "id": "p0-terraform-repair-evaluation",
  "kind": "evaluation",
  "source": "terraform fmt -check; terraform init -backend=false -input=false; terraform validate -no-color; tofu init -backend=false -input=false; tofu validate -no-color (all exit 0)",
  "authoring_run": "p0-codex-adapter-2026-08-24",
  "version": "1",
  "relations": [
    {
      "predicate": "EVALUATES",
      "target": "p0-terraform-repair-artifact",
      "source": "phase-0/p0-agent-terraform/fixtures/broken-module/main.tf"
    },
    {
      "predicate": "DEPENDS_ON",
      "target": "p0-terraform-repair-task",
      "source": "phase-0/p0-agent-terraform/task.md"
    }
  ]
}
